{
  "deliveryId": "mailbox.delivery.33333333-3333-4333-8333-333333333333",
  "deliveryToken": "AAAAAAAAAAAAAAAAAAAAAAAAAAAAAAAAAAAAAAAAAAA",
  "consumerId": "provider.antigravity.mcp",
  "claimedAt": "2026-07-14T12:00:10.000Z",
  "leaseExpiresAt": "2026-07-14T12:15:10.000Z",
  "message": {
    "schemaVersion": "bridge-mailbox-v2",
    "kind": "message",
    "messageId": "mailbox.message.11111111-1111-4111-8111-111111111111",
    "projectId": "project.synthetic",
    "sender": {
      "principalId": "principal.codex",
      "sessionId": "session.synthetic",
      "hostId": "host.synthetic"
    },
    "recipient": "antigravity",
    "mode": "default",
    "priority": "normal",
    "sensitivity": "internal",
    "createdAt": "2026-07-14T12:00:00.000Z",
    "expiresAt": "2026-07-15T12:00:00.000Z",
    "promptSha256": "e9b491b1862dc5df9677da88ea89885e27d6eab65ad9a28ad693288db84cfa46",
    "prompt": "Synthetic mailbox prompt.",
    "dispatchAuthorization": {
      "approvalRef": "approval.synthetic.001",
      "authorizedAt": "2026-07-14T12:00:00.000Z",
      "expiresAt": "2026-07-15T12:00:00.000Z",
      "provider": "antigravity",
      "destination": { "kind": "local-mcp", "surface": "antigravity" },
      "useCount": 1
    }
  }
}
